artist,song,link,text,Moods
Styx,Too Much Time On My Hands,/s/styx/too+much+time+on+my+hands_20132890.html,"Yeah, here I am sitting on this bar stool,  
Talking like a damn fool  
Got the twelve o'clock news blues  
And I've given up hope for the afternoon soaps  
And a bottle of cold brew  
Is it any wonder I'm not crazy  
Is it any wonder I'm sane at all  
  
Well I'm so tired of losing  
I've got nothing to do and all day to do it  
Well I'd go out cruising, but I've no place  
To go and all night to get there  
Is it any wonder I'm not a criminal  
Is it any wonder I'm not in jail  
  
Is it any wonder I've got too much time on my hands  
It's ticking away with my sanity  
I've got too much time on my hands  
It's hard to believe such a calamity  
I've got too much time on my hands  
And it's ticking away, ticking away from me  
  
(Too much time on my hands)  
It's tick tick tick tick ticking away  
(Too much time on my hands)  
And I don't know what to do with myself  
(Too much time on my hands)  
  
(Too much time on my hands)  
(Too much time on my hands)  
(Too much time on my hands)  
  
Now I'm a jet fuel genius  
I can solve the world's problems  
Without even trying  
I've got dozens of friends, and the fun never ends  
That is as long as I'm buying  
Is it any wonder I'm not the President  
Is it any wonder I'm null and void  
  
Is it any wonder I've got too much  
Time on my hands  
It's ticking away with my sanity  
I've got too much time on my hands  
It's hard to believe such a calamity  
I've got too much time on my hands  
And it's ticking away, ticking away from me  
  
(Too much time on my hands)  
Ticky tick tick tick tick ticking away  
(Too much time on my hands)  
And I don't know what to do with myself  
(Too much time on my hands)  
Umm mmm  
(Too much time on my hands)  
Tick tick tick ticking away  
(Too much time on my hands)  
Umm mmm  
(Too much time on my hands)  
Too much time on my hands  
Too much time on my

",Techno
Peter Tosh,Fools Die,/p/peter+tosh/fools+die_20194694.html,"Fools Die  
The lips of the righteous teaches many  
But fools die for want of wisdom  
The rich man's wealth is in the city  
Vexation of the soul is vanity  
Destruction of the poor is their poverty  
The poor man's wealth is in a holy, holy place  
Why do you fight eachother  
Why do you kill your brother  
Then your reward will be the cemetery  
We got to build a better nation  
Clean up, clean up Jah creation  
Or there will be no future for you, you and me

",Trance
Marilyn Manson,Posy Guy (Your Turn),/m/marilyn+manson/posy+guy+your+turn_20615097.html,"Marilyn:  
You harmed her, no reason why  
She fuckin hates yeah you  
Like she hates the""one true god""  
  
She tried to give you everything  
You just threw it away  
Turned it into bullshit  
And runned away  
  
Girl:  
Now its your turn  
To cry and beg  
For some miracle from your god  
And whine like a hog  
Everthing that comes  
Goes by  
Its your turn  
I hope you die  
In the shadow of the Valley of Death  
  
Marilyn:  
Shes now looking for me  
Someone who does aprecciate  
Like drugs for life  
  
Don't believe you let her go  
Now she gets me high high  
While you beg and fuck  
  
Girl x 2  
  
Marilyn:  
Now she sees the real thing  
Doesn't know  
Why she cryed for a motherfucker like you  
Like you... Like you.....  
  
Shouting both: This song is dedicated for all the motherfuckers  
Who harm with no reason, hey your not the drug, so don't try to be one  
Remember that shit comes.. And goes by... The sorrow exists

",Tribal
Backstreet Boys,Baby I'm Yours,/b/backstreet+boys/baby+im+yours_20595490.html,"Understand girl that my heart is in your hands  
And I'm cautious of fallin' in love again  
Please don't hurt me...  
I'm scared  
Don't desert me  
I'm afraid of being a fool again  
  
Chorus  
Baby I'm yours if you want me  
(If you want my love)  
Baby I'm yours if you need me  
Lovin' you forever if you want me  
(Give me your love)  
Baby I'm yours if you need me  
  
Realize girl that my faith is kind of torn  
So watch your step girl  
Because my heart is weak and worn  
So won't you please be careful I'm fragile  
I can't imagine the damage  
I'll have to handle  
If you hurt me one more time  
Please be mine  
  
Chorus  
  
Hey baby I finally found someone  
That I can depend on  
I just want you to know  
That I'm your sweetheart...  
Hey someone that you can depend on...  
Don't you ever go nowhere, baby  
  
Chorus

",Trip Hop
Rascal Flatts,She's Leaving,/r/rascal+flatts/shes+leaving_21005515.html,"She's got a suitcase packed in the trunk, trunk, trunk  
She's got a see you later song that went bump, bump, bump  
She's got a hurtin heavy heart goin' thump, thump, thump  
She's leaving  
She's got a bucket of tears goin' drop, drip, drop  
And that ring on her finger is comin' off, off, off  
She's got a boyfriend yelling to stop, stop, stop  
She's leaving  
  
Should have done this, should have done that  
Should have seen it comin', guess you don't see nothing when you're runnin'
'round  
She's history, wrapped in a memory,  
Tied up tight with a broken heart strings of the things that will never be  
She's leaving (she's leaving now)  
  
She left your dreams in the washing machine, chine, chine  
Now she's a red light turning to green, green, green  
She's a goner if you know what I mean, mean, mean  
She's leaving  
  
Should have done this, should have done that  
Should have seen it comin', guess you don't see nothing when you're runnin'
'round  
She's history, wrapped in a memory,  
Tied up tight with a broken heart strings of the things that'll never be  
She's leaving  
Oh no, she's leaving  
  
Look at her go down right over your road,  
Sayin' to herself shoulda done this a long time ago  
  
Should have done this, should have done that  
Should have seen it comin', guess you don't see nothing when you're runnin'
'round  
She's history, wrapped in a memory,  
Tied up tight with a broken heart strings of the things that will never be  
She's, she's, she's leaving!  
She's leaving  
  
She's got a suitcase packed in the trunk, trunk, trunk  
She's got a see you later song that went bump, bump, bump  
She's got a hurtin heavy heart that went thump, thump, thump  
She's leaving (She's leaving)  
She's got a bucket of tears goin' drop, drip, drop  
And that ring on her finger is comin' off, off, off  
She's got a boyfriend yelling to stop, stop, stop  
She's leaving  
She's leaving man  
  
Look at her go down right over your road  
She's leaving, she's leaving, leaving

",Samba
Judas Priest,Screaming For Vengeance,/j/judas+priest/screaming+for+vengeance_20076131.html,"Hey listen don't you let 'em get your mind  
Fill your brain with orders and that's not right  
They're playing at a game that draws you closer  
Till you're living in a world that's ruled by fear  
  
Always takin' baby out that's o.k.  
What they're givin' maybe it's out of phase with me  
Told you once you're never gonna win the race  
Same old no tomorrow kicked in the face  
  
We are screaming for vengeance  
The world is a manacled place  
Screaming, screaming for vengeance  
The world is defiled in disgrace  
  
Tie a blindfold all around your head  
Spin you round in the torture before the dread  
And then you're pushed and shoved into every corner  
Then they lead you out into the final slaughter  
  
As the sweat is running down your neck  
All your praying for's to stop your body breakin' up  
Oh your heart is pumping gonna soon explode  
Got to fight the horror of this mental load  
  
We are screaming for vengeance  
The world is a manacled place  
Screaming, screaming for vengeance  
The world is defiled in disgrace  
  
So you wait it out and bide your time  
Rip off that straight jacket gotta break that line  
Everyone who wins in the great escape  
Leaves a thousand more who suffer in their wake  
  
I don't talk about it but that's alright  
Table's turned now there's a revenge in sight  
If it takes forever babe I tell ya I can wait  
Send them screaming back through their hell's own gate  
  
We are screaming for vengeance  
The world is a manacled place  
Screaming, screaming for vengeance  
The world is defiled in disgrace  

",Scandinavian
Olivia Newton-John,Do You Feel,/o/olivia+newton+john/do+you+feel_20103287.html,"(Olivia Newton-John)  
Do you feel the way I do  
Tell me now oh tell me now  
I need to know that it's true  
Oh do you feel the way I do  
I need to know  
Do you love me the way that I love you  
Tell me now oh tell me now  
I need to know that it's true  
Oh do you feel the way I do  
I need to know  
The world is a wonderful place  
It spins around and spins around  
And spins around in space  
The world has a magic about it  
The stars above are like my love  
You never need to doubt it  
Oh are we real or is this a dream  
Tell me now oh tell me now  
Is it all that it seems  
Oh do you feel the way I do  
I need to know  
The world is a wonderful place  
It spins around and spins around  
And spins around in space  
The world has a magic about it  
And though I try there's so much I  
Will never know about it  
Oh do you feel the way I do  
Tell me now oh tell me now  
I need to know that it's true  
Oh do you feel the way I do  
I need to know  
I need to know  
Do you feel the same way  
Do you feel the same way that I do  
Do you feel like I do  
I need to know  
I need to know  
Do you feel like I do  
  
  

",Sci-Fi
Jose Mari Chan,Love At Thirty Thousand Feet,/j/jose+mari+chan/love+at+thirty+thousand+feet_20662316.html,"Dreaming of love while cruising at high altitude  
Dreaming of making love with you the way we should  
Closer to heaven. We're thirty thousand feet, up in the sky  
Here among the stars, our spirits will fly  
  
Leave all your worries as we soar over the clouds  
Jet lag that's making you appear far from the crowd  
While we're suspended, locked in each others, sweet embrace  
We'll be shooting star through time and space

",Score
Primus,Arnie,/p/primus/arnie_20110880.html,"The man he stepped up to the microphone and he gave it a kiss.  
It was a big wet, slippery kiss.  
And he had sweat dripping off of his nose onto the windscreen.  
As he looked out over the audience he said,  
God bless you, God bless you one and all.  
Then he took a can of Ronson lighter fluid  
And he squirted it over the top of his head.  
And proceeded to light himself on fire  
As he stood there glowing and said,  
Remember this day.

",Scottish
Marilyn Manson,I Put A Spell On You,/m/marilyn+manson/i+put+a+spell+on+you_20089074.html,"I put a spell on you  
Because you're mine.  
I can't stand the things that you do.  
No, no, no, I ain't lyin'. No.  
I don't care if you don't want me  
'Cause I'm yours, yours, yours anyhow.  
Yeah, I'm yours, yours, yours.  
I love you. I love you.  
[Repeat Three Times]  
Yeah! Yeah! Yeah!  
Yeah....  
I put a spell on you.  
Lord! Lord! Lord!  
.... 'Cause you're mine, yeah.  
I can't stand the things that you do  
When you're foolin' around.  
I don't care if you don't want me.  
'Cause I'm yours, yours, yours anyhow.  
Yeah, yours, yours, yours!  
I can't stand your foolin' around.  
If I can't have you,  
No one will!  
I love you, you, you!  
I love you. I love you. I love you!  
I love you, you, you!  
I don't care if you don't want me.  
'Cause I'm yours, yours, yours anyhow.

",Sea Shanty
Falco,Macho Macho,/f/falco/macho+macho_20052762.html,"That's underground  
And fly  
Macho Macho  
I don't like your style  
Macho Macho  
You'll be floatin' on the river Nile  
Macho Macho  
So get down on your knees and pray  
Macho Macho  
I'm gonna blow your Macho Macho mind away, away  
And the boys are singin'  
Na - na - na - na - na  
Hip, hip  
Na - na - na - na - na  
So listen  
I heard a story the other day  
And I've been wonderin' what they got to say  
They said you took ma lady for a ride  
They said it lasted to the morning light  
So listen  
I am not a violent boy  
But you touched my lady and she's my  
Favourite toy  
And you're  
Macho Macho  
Fade out  
The boys don't sing anymore  

",Sentimental
Otis Redding,(your Love Keeps Lifting Me) Higher And Higher,/o/otis+redding/your+love+keeps+lifting+me+higher+and+higher_20933752.html,"Your love keeps lifting me higher  
Than I ever been lifted before  
So give me love  
Which is my desire, honey  
I'm gonna be at your side  
Forever more  
  
Now, you know your love  
Keeps lifting me higher  
Than I ever been lifted before  
So give me love, oh  
Which is my desire  
I'm gonna be at your side  
Forever more  
  
Now, once down and broken hearted  
And disappointment was my closest friend  
And than you, you came and heated hearted  
And you know he never showed his face again  
  
Now, you know your love  
Keeps lifting me higher  
Than I ever been lifted before  
So give me love, oh  
Which is my desire  
I'm gonna be at your side  
Forever more, hey, hey, hey  
  
Know your love  
Lifting me higher  
Than I ever been lifted before  
So give me love  
Which is my desire, ha  
I'm gonna be at your side  
Forever more  
  
Now, you know your love  
Keeps lifting me higher  
Than I ever been lifted before  
So give me love, oh  
Which is my desire, oh, honey  
I'm gonna be at your side  
Forever more  
  
Oh I got to tell you 'bout it  
Keep me, lift me all up, lift me  
lift me little higher, now  
Keep me going all up  
I wanna higher, higher, higher, higher  
Get me up there  
I gotta get on up there  
Lift me, lift me, lift me, oh lift me  
Up, up, up, up, up, up  
Gotta get on up  
Gotta, gotta, get on up there

",Sexy
Imagine Dragons,Shots,/i/imagine+dragons/shots_21094325.html,"[Intro]  
I'm sorry for everything  
Oh, everything I've done  
  
[Verse 1]  
Am I out of touch? Am I out of my place?  
When I keep sayin' that I'm lookin' for an empty space  
Oh I'm wishin' you're here, but I'm wishin' you're gone  
  
I can't have you and I'm only gonna do you wrong  
Oh, I'm gonna mess this up, oh, this is just my luck  
Over and over and over again  
  
[Chorus]  
I'm sorry for everything, no, everything I've done  
From the second that I was born it seems I had a loaded gun  
And then I shot, shot, shot a hole through everything I loved  
Oh I shot, shot, shot a hole through every single thing that I loved  
  
[Verse 2]  
Am I out of luck? Am I waiting to break?  
When I keep sayin' that I'm lookin' for a way to escape  
Oh I'm wishin' I had what I'm takin' for granted  
  
I can't have you and I'm only gonna do you wrong  
Oh, I'm gonna mess this up, oh, this is just my luck  
Over and over and over again  
  
[Chorus]  
I'm sorry for everything, no, everything I've done  
From the second that I was born it seems I had a loaded gun  
And then I shot, shot, shot a hole through everything I loved  
Oh I shot, shot, shot a hole through every single thing that I loved  
  
[Bridge]  
In the mean time, we let it go  
At the road sign we used to know  
We can let this drift away  
Oh we let this drift away  
At the bay side, we used to shore  
In the moonlight, we let it go  
We can let this drift away  
Oh we let this drift away  
Cause you've always got to change your mind  
Cause you've always got to change your mind  
Oh love, can you hear me?  
Oh let it drift away  
  
[Chorus]  
I'm sorry for everything, no, everything I've done  
From the second that I was born it seems I had a loaded gun  
And then I shot, shot, shot a hole through everything I loved  
Oh I shot, shot, shot a hole through every single thing that I loved  
  
[Bridge]  
In the mean time, we let it go  
At the road sign we used to know  
We can let this drift away  
Oh we let this drift away  
At the bay side, we used to shore  
In the moonlight, we let it go  
We can let this drift away  
Oh we let this drift away  
Cause you've always got to change your mind  
Cause you've always got to change your mind  
Oh love, can you hear me?  
Oh let it drift away

",Ska
OneRepublic,Love Runs Out,/o/onerepublic/love+runs+out_21081004.html,"I'll be your light, your match, your burning sun,  
I'll be the bright and black that's making you run.  
And I feel alright, and we'll feel alright,  
'Cause we'll work it out, yeah we'll work it out.  
I'll be doin' this, if you ever doubt,  
'Til the love runs out, 'til the love runs out.  
  
I'll be your ghost, your game, your stadium.  
I'll be your fifty-thousand clapping like one.  
And I feel alright, and I feel alright,  
'Cause I worked it out, yeah I worked it out.  
I'll be doin' this, if you ever doubt,  
'Til the love runs out, 'til the love runs out.  
  
I got my mind made up and I can't let go.  
I'm killing every second 'til it saves my soul.  
I'll be running, I'll be running,  
'Til the love runs out, 'til the love runs out.  
And we'll start a fire, and we'll shut it down,  
'Til the love runs out, 'til the love runs out.  
  
There's a maniac out in front of me.  
Got an angel on my shoulder,  
And Mephistopheles  
My momma raised me good, my momma raised me right.  
Momma said ""do what you want, say prayers at night"",  
And I'm saying them, cause I'm so devout.  
'Til the love runs out, 'til the love runs out, yeah.  
  
I got my mind made up and I can't let go.  
I'm killing every second 'til it saves my soul.  
I'll be running, I'll be running,  
'Til the love runs out, 'til the love runs out.  
And we'll start a fire, and we'll shut it down,  
'Til the love runs out, 'til the love runs out.  
  
Ooh, we all want the same thing.  
Ooh, we all run for something.  
Run for God, for fate,  
For love, for hate,  
For gold, and rust,  
For diamonds, and dust.  
  
I'll be our light, your match, your burning sun,  
I'll be the bright and black that's making you run.  
I got my mind made up and I can't let go.  
I'm killing every second 'til it saves my soul.  
I'll be running, I'll be running,  
'Til the love runs out, 'til the love runs out.  
And we'll start a fire, and we'll shut it down,  
'Til the love runs out, 'til the love runs out.  
  
I'll be your light, your match, your burning sun,  
I'll be the bright and black that's making you run.  
And I feel alright, and we'll feel alright,  
'Cause we'll work it out, yeah we'll work it out.  
And we'll start a fire, and we'll shut it down,  
'Til the love runs out, 'til the love runs out.  
'Til the love runs out.

",Slow
Dewa 19,Arjuna,/d/dewa+19/arjuna_21104930.html,"[Verse 1]  
Sudah kudaki gunung tertinggi  
Hanya untuk mencari di mana dirimu  
Sudah kujelajahi isi bumi  
Hanya untuk dapat hidup bersamamu  
  
[Verse 2]  
Sudah kuarungi laut samudera  
Hanya untuk mencari tempat berlabuhmu  
Tapi semakin jauh ku mencari  
Cinta semakin aku tak mengerti  
  
[Chorus]  
Akulah arjuna  
Yang mencari cinta  
Wahai wanita  
Cintailah aku  
  
[Verse 3]  
Mungkin kutemui cinta sejati  
Saat aku hembuskan nafas terakhirku  
Mungkin cinta sejati memang tak ada  
Dalam cerita kehidupan ini  
  
[Chorus]  
Akulah arjuna  
Yang mencari cinta  
Wahai wanita  
Cintailah aku  
  
[Bridge]  
Akulah arjuna 6x  
  
Back to [Chorus]

",Smooth
Stevie Wonder,A Time To Love,/s/stevie+wonder/a+time+to+love_20535343.html,"We have time for racism  
We have time for criticism  
Held bondage by our ism's  
When will there be a time to love  
  
We make time to debate religion  
Passing bills and building prisons  
For building fortunes and passing judgments  
When will there be a time to love  
  
At this point in history we have a choice to make  
To either walk a path of love  
Or be crippled by our hate  
  
We have time to cause pollution  
We have time to cause confusion  
All wrapped up in our own illusions  
When will there be a time to love  
  
We make time to conquer nations  
Time for oil exploration  
Hatred, violence and terrorism  
When will there be a time to love  
  
At this moment in time  
We have a choice to make  
Father God is watching  
While we cause mother earth so much pain  
It's such a shame  
  
Not enough money for  
The young, the old and the poor  
But for war there is always more  
When will there be a time to love  
  
We make time for paying taxes  
Or paying bills and buying status  
But we will pay the consequences  
If we don't make the time to love  
  
Now's the time to pay attention  
Yes now is the time to love  
A time love, love  
A time to Love  
Please, please won't you tell me  
When will there be a time to love

",Soul
Tom T. Hall,I Love,/t/tom+t+hall/i+love_20138705.html,"I love little baby ducks, old pickup trucks  
Slow-movin' trains and rain  
I love little country streams, sleep without dreams  
Sunday school in May and hay  
And I love you, too  
  
I love leaves in the wind, pictures of my friends  
Birds of the world and squirrels  
I love coffee in a cup, little fuzzy pups  
Bourbon in a glass, and grass.  
And I love you, too  
  
I love honest, open smiles, kisses from a child  
Tomatoes on the vine and onions  
I love winners when they cry, losers when they try  
Music when it's good and life  
And I love you, too.

",Sound Effects
Drake,Too Much,/d/drake/too+much_21068175.html,"Don't think about it too much, too much, too much, too much  
There's no need for us to rush it through  
Don't think about it too much, too much, too much, too much  
This is more than just a new lust for you  
  
Done saying, I'm done playing  
Last time was on the outro  
Stuck in the house, need to get out more  
I've been stacking up like I'm fundraising  
Most people in my position get complacent  
Come places with star girls, end up on them front pages  
I'm quiet but I just ride with it  
Moment I stop having fun with it, I'll be done with it  
I'm the only one that's putting shots up  
And like a potluck, you need to come with it  
Don't run from it, like H-Town in the summer time, I keep it 100  
Lot of girls in my time there, word to Paul Wall, not one fronted  
I was birthed there in my first year, man I know that place like I come from
it  
Backstage at Warehouse in '09 like ""Is Bun coming?  
Fuck that, is any one coming 'fore I show up there and ain't no one there?""  
These days, I could probably pack it for like twenty nights if I go in there  
Back rub from my main thing, I've been stressed out  
Talking to her like back then they didn't want me, I'm blessed now  
Talking to her like this drop, bet a million copies get pressed out  
She tell me, ""Take a deep breath, you're too worried about being the best out""  
  
Don't think about it too much, too much, too much, too much  
There's no need for us to rush it through  
Don't think about it too much, too much, too much, too much  
This is more than just a new lust for you  
  
Someone go tell Noel to get the Backwoods  
Money got my whole family going backwards  
No dinners, no holidays, no nothing  
There's issues at hand that we're not discussing  
Look, I did not sign up for this  
My uncle used to have all these things on his bucket list  
And now he's acting like, oh, well, this is life, I guess, ""Nah, fuck that
shit  
Listen man, you can still do what you wanna do, you gotta trust that shit""  
Heard once that in dire times when you need a sign, that's when they appear  
Guess since my text message didn't resonate, I'll just say it here  
Hate the fact my mom cooped up in her apartment, telling herself  
That she's too sick to get dressed up and go do shit, like that's true shit  
And all my family from the M-Town that I've been 'round, started treating me
like I'm ""him"" now  
Like we don't know each other, we ain't grow together, we just friends now  
Shit got me feeling pinned down, pick the pen up and put the pen down  
Writing to you from a distance like a pen pal, but we've been down  
  
Don't think about it too much, too much, too much, too much  
There's no need for us to rush it through  
Don't think about it too much, too much, too much, too much  
This is more than just a new lust for you  
  
Don't think about it too much, too much, too much, too much  
There's no need for us to rush it through  
Don't think about it too much, too much, too much, too much  
This is more than just a new lust for you

",Soundtrack
Modern Talking,Can't Let You Go,/m/modern+talking/cant+let+you+go_20094740.html,"You don't need nobody  
When you're down and so alone  
And there's no telephone  
No one calls you at home, my baby  
Oh tell me that you need me  
And I'm sailing back to you  
And I'm staying, yes it's true  
For you I am the fool, your my lady  
  
Can't let you go, I need you so  
Can't let you go, the time will show  
Can't let you go, you break my heart for all the time  
  
Heaven will miss an angel  
And I know you are the sun  
But baby now you're gone  
My heart it needs a home, oh baby  
Oh tell me that you miss me  
And I'm driving home to you  
You broke the golden rules  
For you I am the fool, your my lady

",Spanish
