artist,song,link,text,Moods
Chris Brown,Changed Man,/c/chris+brown/changed+man_20846326.html,"Daily  
I've been waiting  
For the time to pass  
And Let it fade in  
But baby, my patience  
Is driving me crazy  
Making me fall apart  
What do you do  
When the truth isn't  
Quite enough?  
They lookin at you  
Tellin you  
We need to break it up  
You need to trust what you do  
It's you and me my love  
But Ima make it up to you  
And show the world  
I'm a changed man  
Cause you mean much to me  
I don't wanna be done  
I'm doing all that I can  
And everybody hates Chris  
They can never understand  
So can we love  
Can we love  
Can we love  
Can we love  
Can we love  
Can we love  
Can we love again  
Girl I know I told you  
Baby this ain't over  
This ain't over  
It ain't over  
I remember your touch  
God I miss you so much  
Please believe me  
Baby I'm sorry  
And all of this money and fame  
Can never amount  
To every morning when I see your face  
What do you do?  
When the truth isn't  
Quite enough?  
They looking at you  
Tellin you  
We need to break it up  
You need to trust what you do  
It's you and me my love  
But Ima make it up to you  
And show the world  
I'm a changed man  
Cause you mean much to me  
I don't wanna be done  
I'm doing all that I can  
And everybody hates Chris  
They can never understand  
So can we love  
Can we love  
Can we love  
Can we love  
Can we love  
Can we love  
Can we love again again  
Girl I know I told you  
Baby this ain't over  
This ain't over  
It ain't over  
Saying I'm sorry  
Doesn't make it alright  
I know  
I know  
But I believe that we can make it  
If we try  
If we try  
Yeah, yeah  
Wooaaaah  
I'm a changed man  
Cause you mean much to me  
And I don't wanna be done  
I'm doing all that I can  
And everybody hates Chris  
They can never understand  
So can we love  
Can we love  
Can we love  
Can we love  
Can we love  
Can we love  
Can we love again  
Girl I know I told you  
Baby this ain't over  
This ain't over  
It ain't over  
It ain't over  
Ohhhhhh...  
It ain't over.

",Noise
John Martyn,Ballad Of An Elder Woman,/j/john+martyn/ballad+of+an+elder+woman_20155991.html,"Now woman, don't you feel sad when you see your life go round  
And you realise you've been drinking all of your years like wine?  
You're gambling with time and you know you just can't win  
But still you feel that somehow you've just got to keep on trying  
And woman, it's your heart I hear crying  
Now the young man by your side is your husband, or so you say  
In reality, he's a link with a past you just can't replace  
You tell the world you're happy when you're lying in his arms  
Oh, but his youth has made you hate to see his face  
And woman, it's your heart I see crying  
Now you're standing like some tree, oh, and the blossom has blown away  
And the last leaf has gone crumbling tumbling towards the ground  
You have nothing to teach me, just have nothing at all to say  
Except to keep on telling me about all the happiness that you do think you
have found

",Norwegian
Ramones,Can't Seem To Make You Mine,/r/ramones/cant+seem+to+make+you+mine_20113766.html,"I can't seem to make you mine  
I can't seem to make you mine  
You're flyin' around like a bee  
Hurtin' everything you see  
I tried everything I know  
To make you wanna love me so  
The only thing you do  
Is try to put the hurt on me  
  
Can't you see what you're doin' to me  
You fill my heart with a misery  
With every breath and step I take  
I'm more in love with you  
  
I can't go on like this  
A little bit of love, not one kiss  
I gotta have your love everyday  
A love that's real that will stay  
I can't seem to make you mine  
I can't seem to make you mine  
I can't seem to make you mine  
I can't seem to make you mine  
Can't you see what you're doin' to me  
You fill my heart with a misery  
With every breath and step I take  
I'm more in love with you  
  
I can't seem to make you mine  
I can't seem to make you mine  
Come back, baby, to me  
In my misery  
I give you love, not any day  
Never ever go away  
I can't seem to make you mine  
I can't seem to make you mine

",Opera
Dan Fogelberg,What You're Doing,/d/dan+fogelberg/what+youre+doing_20035718.html,"Look...what you're doing  
Baby what in heaven are you thinking of?  
Look...what you're doing  
Will you throw away such sweet, sweet love,  
Will you throw away such sweet, sweet love.  
You used to say that you would always stay  
But now you say you want to find your freedom.  
But are the promises of being free  
Worth the sacrifice of all you had with me.  
You know I've always tried the best I could  
To prove my love to you and make you happy  
And once upon a time if felt so good  
What has happened now to make you want to fly.  
Do you want to see me cry?  
Look...what you're doing  
Baby what in heaven are you thinking of?  
Look...what you're doing  
Will you throw away such sweet, sweet love,  
Will you throw away such sweet, sweet love.  
I ain't the fool that you believe I am  
You tell your lies but I can see right through them.  
Cause in your eyes I see another man  
But he will never love you like you know I can.  
Oh, girl, you know I can.  
(You better open up your eyes and)  
Look...what you're doing  
Baby what in heaven are you thinking of?  
Look...what you're doing  
Will you throw away such sweet, sweet love,  
Will you throw away such sweet, sweet love.  

",Orchestral
John Legend,Love The Way It Should Be,/j/john+legend/love+the+way+it+should+be_20967578.html,"Whoa, oh, yeah  
  
Time is gettin' harder and harder  
More and more each day, yeah  
Still I am determined that I. 'm never gonna change my way  
Thinking 'bout love the way it should be  
You gotta open your eyes and you will see  
About love the way it should be  
You gotta make up your minds and you'll advance humanity  
Humanity, humanity, humanity, whoa  
  
What happened to the love  
That they are all talking about?  
It's nothing but useless words  
Coming from out of their mouths  
Talking 'bout love the way it should be  
We gotta open our eyes and we will see  
About love the way it should be  
We gotta make up our minds and we'll advance humanity  
Humanity, humanity, humanity, whoa  
  
Whoa, yes, yeah!  
  
What happened to the love  
That they are all talking about?  
It's nothing but useless words  
That are coming from out of their mouth  
Talking 'bout love the way it should be  
Open our eyes and we will see  
About love the way it should be  
We gotta make up our minds and we'll advance humanity  
Humanity, humanity, humanity, whoa  
  
Listen, people listen  
You got the notion (I hope so)  
Listen what I'm saying to you  
You got the notion (I hope so)  
A little bit of justice and peace  
You got the notion (I hope so)  
Bring a little love for everyone  
You got the notion (our hope's on)  
You got the notion  
You got the notion  
You got the notion (our hope's on)  
Oh, get in the motion  
Get in the motion  
You got the notion (I hope so)  
You got the notion  
You got the notion  
You got the notion (I hope so)  
Get in the motion  
Get in the motion  
You got the notion (I hope so)

",Oriental
Jackson Browne,It's Been Raining Here In Long Beach,/j/jackson+browne/its+been+raining+here+in+long+beach_20068673.html,"It's been raining here in long beach  
The dampness in the air  
Tends to straighten out my hair  
Against my wishes  
But the traces of a song reach  
My tattered ear once more  
Lend me courage to ignore  
The smell of fishes  
  
I was a drunken lout, I ran about  
With ladies that I knew  
I did 'em wrong all night long  
Singing 23 skidoo  
  
Huzahh...huzahh...  
Once upon a time I was a kid  
Well I don't know what happened then  
But I'm warning all you younger men  
On your way to long beach think again  
You can't afford to settle down in long beach  
  
I had a rack and coat, a paddle boat  
I played the ukelele  
Beneath the moon in june I'd croon  
Won't you come on home little baby  
  
Huzahh...huzahh...  
Once upon a time I was a kid  
But now my hair is turning gray  
I'm getting fatter every day  
If you got any sense you'll stay away  
And never give another thought to long beach  
And never give a moment's thought to long beach

",Party
The White Stripes,Dead Leaves And The Dirty Ground,/w/white+stripes/dead+leaves+and+the+dirty+ground_10187186.html,"Dead leaves and the dirty ground  
When I know you're not around  
Shiny tops and soda pops  
When I hear your lips make a sound  
When I hear your lips make a sound  
  
Thirty notes in the mailbox  
Will tell that I'm coming home  
And I think I'm gonna stick around  
For a while so you're not alone  
For a while so you're not alone  
  
If you can hear a piano fall  
You can hear me coming down the hall  
If I could just hear your pretty voice  
I don't think I need to see ya at all  
I don't think I need to see ya at all  
  
Soft hair and a velvet tongue  
I want to give you what you give to me  
And every breath that is in your lungs  
Is a tiny little gift to me  
Is a tiny little gift to me  
  
I didn't feel so bad till the sun went down  
Then I come home  
No one to wrap my arms around  
Wrap my arms around  
  
Well any man with a microphone  
Can tell you what he loves the most  
And you know why you love at all  
If you're thinking of the holy ghost  
If you're thinking of the holy ghost

",Patriotic
Alice Cooper,I Am Made Of You,/a/alice+cooper/i+am+made+of+you_20975259.html,"I was just a shadow  
In the beginning  
I was alone  
  
In the beginning, I was blind  
Living in a world devoid of light  
In the beginning  
There was only night  
  
I was shattered  
Left in pieces  
And I felt so cold inside  
Then I called you  
From the darkness  
Where I hide  
  
I am made of you  
I am made of you  
I am made of you  
I am made of you  
  
In the beginning  
You were evolution  
A river of salvation  
And now I believe  
  
All I wanted  
All I needed  
Was someone to rescue me  
I was drownin'  
I was dying  
Now I'm free  
  
I am made of you  
I am made of you  
I am made of you  
I am made of you  
  
Here I am now  
I can stand now  
'Cause your love has made me strong  
And forever  
You're the singer  
I'm the song  
  
I am made of you  
I am made of you  
I am made of you  
I am made of you  
I am made of you  
I am made of you  
I am made of you  
I am made of you

",Persian
Paul McCartney,3 Legs,/p/paul+mccartney/3+legs_20105725.html,"Well, when I walk, when I walk  
Walk my horse upon a hill  
Well, when I walk, walk, walk, walk  
Walk my horse upon a hill  
When I lay me down  
Will my lover love me still?  
  
A dog is here  
A dog is there  
My dog, he got three legs  
But he can't run  
  
Well, when I thought, well, I thought  
When I thought you was my friend  
When I thought, well, I thought  
When I thought you was my friend  
But you let me down, ho  
Put my heart around the bend  
  
A fly flies in  
A fly flies out  
Most flies they got three legs  
But mine got one  
  
Well, when I fly, when I fly, when I fly  
When I fly above the clouds  
Oh, when I fly, when I fly, when I fly  
When I fly above the clouds  
You can knock me down with a feather, yes, you could  
But you know it's not allowed  
  
A dog is here  
A dog is there  
My dog, he got three legs  
But he can't run  
  
My dog he got three legs, your dog he got none  
My dog he got three legs, your dog he got none  
My dog he got three legs, your dog he got none

",Piano
Prince,Dj Seduces Sonny,/p/prince/dj+seduces+sonny_20111134.html,"Sonny T.?  
Hey man, sorry 4 fuckin' up your turn-tables  
Mr. Dj (Brother Jules)  
That, that, that's cool man, that's cool  
Y'all didn't have 2 break my hundred fifty dollar glasses though  
But just 2 show you that there ain't no hard feelings (Mmm)  
I got a couple of ladies here I wanna introduce 2 ya (Ahhh)  
Prime beef boy, check it out (Mmm mmm)  
Check it out  
It's very nice 2 meet y'all, won't you ladies have a seat? (Mmm)  
Ha ha ha ha (Ahh)  
Sonny T., yeah, fuckin' with me, right (Mmm)  
Wait 'til he gets a couple of sips of that hallucination rain  
Ha ha ha ha  
Ain't gonna be not nice, not nice  
Ha ha ha ha ha ha ha  
Boy

",Pirate
Elton John,Honky Cat,/e/elton+john/honky+cat_20046878.html,"When I look back, boy, I must have been green  
Bopping in the country, fishing in a stream  
Looking for an answer, trying to find a sign  
Until I saw your city lights, honey, I was blind  
  
They said, ""get back, honky cat  
Better get back to the woods.""  
Well, I quit those days and my redneck ways  
And, oh, the change is gonna do me good  
  
You better get back, honky cat  
Living in the city ain't where it's at  
It's like trying to find gold in a silver mine  
It's like trying to drink whiskey from a bottle of wine  
  
Well, I read some books, and I read some magazines  
About those high-class ladies down in New Orleans  
And all the folks back home, well, said I was a fool  
They said, ""oh, believe in the Lord is the golden rule.""  
  
They said, ""stay at home, boy, you gotta tend the farm  
Living in the city, boy, is going to break your heart.""  
But how can you stay when your heart says no?  
How can you stop when your feet say go?

",Polka
Van Morrison,Bright Side Of The Road,/v/van+morrison/bright+side+of+the+road_20143072.html,"From the dark end of the street  
To the bright side of the road  
We'll be lovers once again on the  
Bright side of the road  
  
Little darlin', come with me  
Won't you help me share my load  
From the dark end of the street  
To the bright side of the road  
  
Into this life we're born  
Baby sometimes, bay sometimes we don't know why  
And time seems to go by so fast  
In the twinkling of an eye  
  
Let's enjoy it while we can  
Won't you help me sing my song  
From the dark end of the street  
To the bright side of the road  
  
From the dark end of the street  
To the bright side of the road  
We'll be lovers once again  
On the bright side of the road  
We'll be lovers once again  
On the bright side of the road  
We'll be lovers once again  
On the bright side of the road

",Pop
Natalie Cole,Ask A Woman Who Knows,/n/natalie+cole/ask+a+woman+who+knows_20230789.html,"He stays out every night  
And leaves me all alone  
He never tells me where he goes  
I'm not the only lonely one  
Just ask a woman who knows  
We used to share our troubles  
And the good times too  
  
Now I'm left with all the woes  
I'm not the only sorry one  
Just ask a woman who knows  
The days are long  
  
Oh, but the nights are longer  
I got the lonesomest blues  
You know my only consolation  
Is I ain't got nothing more to lose  
So there you have the story  
Of a love gone wrong  
  
That used to blossom like a rose  
Oh, I'm not the only broken heart  
Just ask a woman who knows  
  
Well my only consolation  
Is that I got nothing more to lose  
So there you have the story  
Of a love gone wrong  
  
That used to blossom like a rose  
But I'm not the only broken heart  
Just ask a woman  
And I'm a woman  
Just ask a woman who knows  
Oh, yeah  
Ask a woman, ask a woman  
And I'm a woman  
Who knows

",Power Ballad
Reo Speedwagon,Building The Bridge,/r/reo+speedwagon/building+the+bridge_20115556.html,"Father to son, husband to wife  
Brother to brother, black man to white  
Living together, falling apart  
Looking for the common ground in every human heart  
It all comes down to the two of us  
Yeah this is where we start  
  
We are building the bridge  
One small stone at a time  
With a lot of love  
And some help from above  
From your heart to mine  
  
There's a land of justice, cities filled with pride  
A mountain of hope, just on the other side  
Across a river of indifference, and a valley of despair  
There's a tower of courage, piercing through the air  
I have a dream for our children, I want to take them there  
  
And we are building the bridge  
One small stone at a time  
With a lot of love  
And some help from above  
From your heart to mine  
  
As we seek out understanding  
As we learn to forgive  
When we open up our minds  
When our words are true and kind  
We are building the bridge

",Progressive
X-Treme,Love Song,/x/x+treme/love+song_20249027.html,"This is a love song for you  
To make my dreams comin' true  
Let me be by your side  
I'll be yours all the time.  
I sing a love song for you  
Because my heart going boom!  
You're the one I desire  
Tell me now that you're mine  
This is a love song for you  
To make my dreams comin' true  
Let me be by your side  
I'll be yours all the time.  
I sing a love song for you  
Because my heart going boom!  
You're the one I desire  
Tell me now that you're mine  

",Psychedelic
Bing Crosby,'Round And 'Round The Christmas Tree,/b/bing+crosby/round+and+round+the+christmas+tree_20826110.html,"Round and round the Christmas tree  
Presents hanging there for you and me  
Lights all shining merrily  
Christmas a week away  
  
A-ring around the Christmas tree  
Children making up a melody  
Grown-ups laughing happily  
Christmas a day away  
  
Wishing, hoping, boxes to open  
But we agree it's right to wait  
Turkey and dressing, after the blessing  
And there's just a night to wait  
  
Round and round the Christmas tree  
Opening presents with the family  
One for you and two for me  
Oh what a Christmas Day  
  
Ding dong, ding dong, ding dong,  
Ding dong, ding dong, ding dong  
Tra-la-la-la-la-la-la-la-la  
  
Round and round the Christmas tree  
Presents hanging there for you and me,  
Lights all shining merrily  
Christmas a week away  
  
Lights all shining merrily  
Christmas a week away  
La-la-la-la-la-la-la-la-la  
La-la-la-la-la-la-la-la-la  
La-la-la-la-la-la-la-la-la  
La-la-la-la-la-la-la-la-la  
  
Wishing, hoping, boxes to open  
But we agree it's right to wait  
Turkey and dressing, after the blessing  
And there's just a night to wait  
  
Round and round the Christmas tree  
Opening presents with the family  
One for you and two for me  
Oh what a Christmas Day  
Oh what a Christmas Day  
Oh what a Christmas Day  
Oh what a Christmas Day  
Oh what a Christmas Day

",Punk
Kirk Franklin,Smile Again,/k/kirk+franklin/smile+again_20255960.html,"Tell me how you feel when you're all alone no one to say  
I love you and you feel all your hope is gone  
Try to call your best friend.  
But he's not there, so you wind up feeling empty like no one cares  
  
My brother don't you worry storms don't last always  
There's a man from glory full of mercy and grace  
  
He'll pick you up he'll hold your hand he'll ease your pain  
so you can smile again good God Almighty  
  
Tell me how you feel when you're all alone  
No one to say I love you and you feel all your hope is gone  
Try to call your best friend but he's not there  
So you wind up feeling empty like no one cares  
  
My brother don't you worry storms don't last always  
There's a man from glory full of mercy and grace  
  
Keep your head up smile again  
keep your head up smile again

",R&B
Pink Floyd,The Thin Ice,/p/pink+floyd/the+thin+ice_20108799.html,"Momma loves her baby  
And daddy loves you too.  
And the sea may look warm to you babe  
And the sky may look blue  
Ooooh baby  
Ooooh baby blue  
Oooooh babe.  
  
If you should go skating  
On the thin ice of modern life  
Dragging behind you the silent reproach  
Of a million tear-stained eyes  
Don't be surprised when a crack in the ice  
Appears under your feet.  
You slip out of your depth and out of your mind  
With your fear flowing out behind you  
As you claw the thin ice.

",Raggae
Electric Light Orchestra,Mr. Radio,/e/electric+light+orchestra/mr+radio_10095528.html,"Hello, Mr. Radio, you friendly station,  
So glad of your company, your morning music,  
My wife she ran away, she left our home,  
And though you're here with me, I'm on my own.  
  
Hello, Mr. Radio, you friendly speaker,  
You played my request today, request to see her  
Your voice comes riding home across the air,  
You travel 'round the world, but still you're here.  
  
I heard on the news today the world is no good,  
But if she returns today mine could be so good  
I look into the sky, your waves rush by,  
The weather man has lied, it makes me cry.  
  
Hello, Mr. Radio, do I disturb you?  
Sometimes I forget my place, I seem to know you  
I miss you when you close, you'll never know,  
And when your programs go, I'm on my own.

",Rap
Dolly Parton,A Christmas To Remember,/d/dolly+parton/a+christmas+to+remember_20041798.html,"You've made this a Christmas to remember  
Springtime feelin's in the middle of December  
Strangers meet and they willingly surrender  
Oh! What a Christmas to remember  
Almost went to Aspen but something told me no  
I considered Mammoth but there wasn't enough snow  
And I even thought of Gatlinburg but that seemed so far to go  
So I headed up to Tahoe for a Christmas on the slopes  
  
And I had fantasized about Christmas in this way  
Curled up by a fireplace in a Tahoe ski chalet  
With a fast talking lover and some slow burning wood  
But even in my wildest dreams it never got this good and  
  
You've made this a Christmas to remember  
Springtime feelin's in the middle of December  
Change the radio and I'll turn the lights down dimmer  
Oh! What a Christmas to remember  
  
Strangers when we met, lovers as we leave  
Christmas to remember, too good to believe  
Don't know how or when, but I know we'll meet again  
We'll come blowin' back to somewhere like some wild restless winter's wind  
  
And you've made this a Christmas to remember  
Springtime feelin's in the middle of December  
Neath the mistletoe you kissed me warm and tender  
Oh! What a Christmas to remember  
  
We loved and laughed and played and joked  
Sang Christmas songs and talked to folks  
Sleighed the fields and skied the slopes  
Then to the lodge for dinner  
But now it's time for us to go  
As our hearts melt like chimney snow  
There's just one thing I want to know  
Can we do this next winter  
Oh! What a Christmas to remember  
  
You've made this a Christmas to remember  
Springtime feelin's in the middle of December  
Though the fire is hot, we'll just have to let it simmer  
Oh! What a Christmas to remember  
  
You've made this a Christmas to remember  
Springtime feelin's in the middle of December  
Though it's cold outside we'll just stroke the burning embers  
Oh! What a Christmas to remember

",Reggae
George Formby,They Laughed When I Started To Play,/g/george+formby/they+laughed+when+i+started+to+play_20795316.html,"Now when I learned to play the ukulele,  
I used to practice day and night.  
My pals all roared as I fumbled at a chord,  
But I couldn't get the darned thing right.  
  
They laughed when I started to play, they laughed so hearty.  
Only two lessons I had, I went up the scale and down the scale,  
It wasn't so bad  
But one chap, he said ""Oh what a mug, why you can't learn that way""  
He took the uke off me and said ""Now I'll have a try""  
Just then the 'g' string bust and flew right into his eye.  
He laughed when I started to play, but he didn't laugh again all day  
  
Oh they laughed when I started to play, oh they laughed so hearty  
Strip poker that's a good game,  
Once I lost my trousers to a gambling dame  
But when, I started shuffling the cards, then the luck came my way.  
I won a frock and undies, she was left I declare  
As bare as any savage and as savages are bear  
She laughed when I started to play,  
But she didn't laugh again that day.  
  
Now once I watched a game of water polo,  
With players from a ladies school.  
The girls all cried ""Won't you make up a side?""  
So I dashed into the bathing pool.  
They laughed when I started to play, oh how they laughed so hearty.  
In goal, I paddled about, a big ball in the water soon I started to clout.  
Each time, that it came bobbing back, well I smacked it away.  
Just then the ball turned over and a girl said ""No larks"",  
""Seven times you've hit me where I can't show the marks.""  
She laughed when I started to play,  
But she didn't laugh again that day.

",Religious
