artist,song,link,text,Moods
Marillion,Abraham Martin And John (acoustic),/m/marillion/abraham+martin+and+john+acoustic_20159526.html,"Has anybody here  
Seen my old friend Abraham  
Can you tell me  
Where he has gone  
'Cos he freed a lot of people  
But it seems the good die young  
I just turned around  
And he was gone  
Has anybody here  
Seen my old friend Martin  
Can you tell me  
Where he has gone  
'Cos he freed a lot of people  
But it seems the good die young  
I just looked around  
And he was gone  
Has anybody here  
Seen my old friend John  
Can you tell me  
Where he has gone  
'Cos he freed a lot of people  
But it seems the good die young  
I just looked around  
And he was gone  
I just looked around  
And he was gone

",Lyrical
Hank Williams Jr.,Cajun Baby,/h/hank+williams+jr/cajun+baby_20167848.html,"Way down yonder in the bayou country in dear old Louisianne  
That's where lives my Cajun baby, the fairest one in the land  
Her teeth're white and pearly hair black as coal  
Wouldn't trade my Cajun baby for the world's gold  
Way down yonder in the bayou country in dear old Louisianne  
  
My heart's been sad and lonely since the day I left her side  
But today I got her letter said she'd be my Cajun bride  
Gonna go and wed my Cajun baby and live by the old bayou  
Eat a lotsa shrimp and crawfish ride around in my old pirogue  
  
Way down yonder in the bayou country in dear old Louisianne  
That's where lives my Cajun baby, the fairest one in the land  
Her teeth're white and pearly hair black as coal  
Wouldn't trade my Cajun baby for the world's gold  
Way down yonder in the bayou country in dear old Louisianne  
  
Before the sun goes down this evening, I'll be on my way  
To see my Cajun baby and there I'm gonna stay  
On a Saturday night we go dancin' and listen to the fiddle-o  
Lord I got me a Cajun baby just a livin' and a lovin' by the old bayou  
  
Way down yonder in the bayou country in dear old Louisianne  
That's where lives my Cajun baby, the fairest one in the land  
Her teeth're white and pearly hair black as coal  
Wouldn't trade my Cajun baby for the world's gold  
Way down yonder in the bayou country in dear old Louisianne

",Mariachi
Bob Seger,No Mans Land,/b/bob+seger/no+mans+land_20021899.html,"Headin' in or headin' out  
Standing on the shore  
Pause a moment to reflect  
Which trip costs you more  
Between the ever restless crowds  
  
And the silence of your room  
Spend an hour in no man's land  
You'll be leaving soon  
  
Victims come and victims go  
There's always lots to spare  
  
One victim lives the tragedy  
One victim stops to stare  
  
And still another walks on by  
Pretending not to see  
They're all out there in no man's land  
'Cause it's the safest place to be  
  
But sanctuary never comes  
Without some kind of risk  
Illusions without freedom  
  
Never quite add up to bliss  
The haunting and the haunted  
Play a game no one can win  
The spirits come at midnight  
  
And by dawn they're gone again  
And so it seems our destiny  
To search and never rest  
To ride that ever changing wave  
That never seems to crest  
To shiver in the darkest night  
Afraid to make a stand  
And then go back and do our time  
Out there in no man's land

",Martial
Hillsong,People Just Like Us,/h/hillsong/people+just+like+us_20832267.html,"Makes you wanna dance  
Makes you wanna sing  
Makes you wanna shout all about it  
Shout all about it  
Shout it that Jesus is King  
Makes you wanna dance  
Makes you wanna sing  
Makes you wanna shout all about it  
Shout all about it  
Shout it that Jesus is King  
Every nation power and tongue  
Will bow down to Your name  
Every eye will see  
Every ear will hear Your name proclaimed  
And this is gonna be our cry  
Until You come again  
Jesus is the only name  
By which man can be saved  
All over the world people just like us  
Are calling Your name  
Living in Your love  
All over the world people just like us  
Are following Jesus  
All over the world people just like us  
Are calling Your name  
Living in Your love  
All over the world people just like us  
Are following Jesus  
Every nation power and tongue  
Will bow down to Your name  
Every eye will see  
Every ear will hear Your name proclaimed  
And this is gonna be our cry  
Until You come again  
Jesus is the only name  
By which man can be saved  
All over the world people just like us  
Are calling Your name  
Living in Your love  
All over the world people just like us  
Are following Jesus  
All over the world people just like us  
Are calling Your name  
Living in Your love  
All over the world people just like us  
Are following Jesus  
We're worshiping Jesus  
We're following Jesus  
We're worshiping Jesus  
We're calling on Jesus  
Makes you wanna dance  
Makes you wanna sing  
Makes you wanna shout all about it  
Shout all about it  
Shout it that Jesus is King  
Makes you wanna dance  
Makes you wanna sing  
Makes you wanna shout all about it  
Shout all about it  
Shout it that Jesus is King  
All over the world people just like us  
Are calling Your name  
Living in Your love  
All over the world people just like us  
Are following Jesus  
All over the world people just like us  
Are calling Your name  
Living in Your love  
All over the world people just like us  
Are following Jesus  
All over the world people just like us  
Are calling Your name  
Living in Your love  
All over the world people just like us  
Are following Jesus  
All over the world people just like us  
Are calling Your name  
Living in Your love  
All over the world people just like us  
Are following Jesus  
We're worshiping Jesus  
We're following Jesus  
We're worshiping Jesus  
We're calling on Jesus  

",Medieval
Emmylou Harris,Luxury Liner,/e/emmylou+harris/luxury+liner_20050141.html,"Luxury liner, forty tons of steel  
If I don't find my baby now  
I guess I never will  
I've been a long lost soul  
For a long, long time  
I've been around  
Everybody ought to know what's on my mind  
You think I'm lonesome, so do I  
So do I  
  
Well, I'm the kind of girl  
Who likes to make a livin' runnin 'round  
And I don't need a stranger  
To let me know my baby's let me down  
You think I'm lonesome, so do I  
So do I  
  
Luxury liner, forty tons of steel  
No one in this whole wide world  
Can change the way I feel  
I've been a long lost soul  
For a long long time  
I've been around  
Everybody ought to know what's on my mind  
You think I'm lonesome, so do I  
So do I

",Mediterranean
Leann Rimes,I Need You,/l/leann+rimes/i+need+you_20081759.html,"I don't need a lot of things  
I can get by with nothing  
With all the blessings life can bring  
I've always needed something  
But I've got all I want  
When it comes to loving you  
You're my only reason  
You're my only truth  
  
I need you like water  
Like breath, like rain  
I need you like mercy  
From heaven's gate  
There's a freedom in your arms  
That carries me through  
I need you  
  
You're the hope that moves me  
To courage again, oh yeah  
You're the love that rescues me  
When the cold winds, rage  
And it's so amazing  
'Cause that's just how you are  
And I can't turn back now  
'Cause you've brought me too far  
  
I need you like water  
Like breath, like rain  
I need you like mercy  
From heaven's gate  
There's a freedom in your arms  
That carries me through  
I need you  
Oh yes I do  
  
I need you like water  
Like breath, like rain  
I need you like mercy  
From heaven's gate  
There's a freedom in your arms  
That carries me through  
I need you  
Oh yes I do  
I need you  
I need you

",Melodic
Nirvana,Mexican Seafood,/n/nirvana/mexican+seafood_20101021.html,"Oh, it's your face, it isn't even  
True the jaws and claims  
You entertain and chew the fungus mold  
Is my intraction  
Oh, it's only a, it is infection.  
Only her tonight, until I pay  
Only her tonight, I fell asleep  
Oh, coming from, the diarrhea  
Oh, her tired form  
I come in peace and live a dirty book  
On the cloudy class, fender burn, and become a childhood mess  
Only her tonight, until I plea  
Only her tonight, until I sing  
Oh, take me back, lets just concise some  
Flies, bugs and fleas and even meal can't  
Stain the vaseline  
It's headed burger's out  
In case it learns and takes it's childhood such

",Metal
Bing Crosby,Go Fly A Kite,/b/bing+crosby/go+fly+a+kite_20528338.html,"Go fly a kite and tie your troubles to the tail  
They'll be blown away by a merry gale,  
Go fly a kite and toss your worries to the wind  
And they won't come back, they'll be too chagrined.  
Go on make friends with the sky  
Have a talk with the sun  
It's the bright way to live, if you'll pardon the pun  
Go fly a kite and you'll imagine you're a king  
Cause you've got your world on a piece of string

",Military
Everclear,A Shameless Use Of Charm,/e/everclear/a+shameless+use+of+charm_20360493.html,"He was rolling in the rumor that he was the loser king for a day  
She was kinda cross-eyed  
She was damaged in a beautiful way  
He was addicted to her body  
When she opened up her legs and her heart  
She was good at all the simple things  
She was addicted to the subtle way he'd rip her apart  
It was a shameless use of charm  
She was delighted with the promise of a life of being bored and annoyed  
He was happy with the pictures that he painted with distortion and noise  
He was a sex-addicted user with a certain kind of flair  
He did really not care that she was dumb and unaware  
She was strong when they were naked and alone in the dark  
It was a shameless use of charm  
Everybody says they're looking for the fairy tale  
No, they are just looking for a way to fall  
Everybody says they are looking for the true love lost  
True love lost  
He was big, bigger than the life she knew  
Back when she was good with being slow and confused  
She was clean  
The best thing he had ever seen  
She looked just like those girls he saw in Playboy magazine  
They were lost  
They were looking for the easy dream  
Living high on borrowed time and running low on self-esteem  
They were lost  
They were helpless to the rush  
It felt just like a white drug  
Everybody says they're looking for the fairy tale  
No, they are just looking for a way to fall  
Everybody says they're looking for the happy ending  
No, they are just looking for a way to fall soft  
Just like anyone, they are just like everyone  
They were looking for the easy way to have it all  
Everybody says that they are looking for the true love lost  
True love lost  
True love lost  
True love lost  

",Minimal
Air Supply,I Don't Believe You,/a/air+supply/i+dont+believe+you_20004798.html,"Who are we to say who we must obey  
to get much better, ooh to get much better,  
Who are we to say there's only one way to read the letter,  
A decision to make and here I must be sure  
it will not break me,  
Not a friend in the place to say to my face  
if I'm right or if I'm wrong.  
  
Who are we to say what we must throw away,  
it doesn't matter, ooh it doesn't matter  
This is for me, this is for you,  
it's not inspiring it's not the right thing  
I can't accept some things,  
irrespective of how long you tell me  
You can make me give in but that's because  
I'm stronger than I should be.  
  
[Chorus]  
I don't believe you, I don't believe the things you say  
There's another way, I can choose to take  
There's another way and it's for me to make  
  
When there's a voice to tell you the choice,  
you will remember, ooh you will remember  
Know what to take, what decisions to make without thinking  
I can't accept some things,  
I never will say yes when I don't mean to,  
You am make me give in but that's because  
I'm happy when I'm with you.  
  
[Chorus]

",Modern
Iggy Pop,Easy Rider,/i/iggy+pop/easy+rider_20066937.html,"In the alley where have I grown  
Hot night sweats our clothes  
My hell is crackin' fire  
That's what you inspire  
Cruel highway entrance signs  
People driving to their lives  
Looks like a giant stream  
But it's just a dream  
  
Easy rider, easy rider  
Easy rider, easy rider  
  
Broken people all around  
Old guarantees that pull you down  
You need a way out, you need a ride  
Cause where you are is suicide  
  
Easy rider, easy rider  
Easy rider, easy rider  
  
Oh I see the sacred dreams  
And if I'm no ?  
I'll feel real ?  
Tearing out my hair  
I see fertility  
In pretty girls I meet  
I love my friend  
Give me hands ?  
  
Highway in the sun  
We listen to the engines run  
I wanna fine myself in you  
You wanna find yourself, too  
  
Easy rider, easy rider [Repeat: x4]

",Mongolian
Hank Williams Jr.,I Can't Take It No Longer,/h/hank+williams+jr/i+cant+take+it+no+longer_20837917.html,"No I can't take it no longer I'm goin' out of my mind  
Baby since you been goner you know I cry all the time  
I'm gonna crawl right back to you on my knees  
Cryin' take me back please baby please please please  
I can't take it no longer I got to be in your arms  
You know it really is a wonder I ain't in the funny farm  
Cause the sun ain't shinin' and it's nine eight degrees  
But I'm shiverin' and shakin' and bout to freeze  
I can't take it no longer I can't take it no longer  
  
[Steel]  
  
I ain't gonna pay no attention to my pride  
Cause without your sweet love I get to be tired  
I can't take it no longer I'm goin' out of my mind  
Baby since you been goner you know I cry all the time  
I'm gonna crawl right back to you on my knees  
Cryin' take me back please baby please please please  
I can't take it no longer I can't take it no longer  
I can't take it no longer I can't take it no longer

",Movie
Overkill,Dreaming In Columbian,/o/overkill/dreaming+in+columbian_20188495.html,"Worlds apart, separation from my mind.  
Just close my eyes to bring me there.  
I fall apart, the pieces are so hard to find.  
A puzzle piece is torn in half.  
  
The absence, of color, surrounds a broken dream.  
Call my eyes to take me there  
One by one I watch, as the pieces disappear,  
My friends become the ones I hate.  
This house of cards it, won't withstand the wind.  
I shut my eyes to escape.  
  
All my whites have turned to black.  
Every time I close my eyes, dream in Columbian.  
All my bugs are comin' back.  
Crawlin' on my face, they speak in!  
Columbian.  
  
Worlds apart, a separation from my soul.  
Worlds apart, the separation is now whole.  
I watch the pieces fall apart.  
I try to make a brand new start.  
I'm fallin' in, I'm fallin' out,  
I'm fallin' up, I'm fallin' back,  
I'm fallin' down, an' fallin' round, an' askin' why?

",Musical
Engelbert Humperdinck,Torero,/e/engelbert+humperdinck/torero_21014457.html,"She was just a child  
When she fall in love  
And he was everything  
That she'd been dreaming of  
She was proud to be the princess  
Of a brave matador  
Cause she knew that it was her  
That he was always fighting for.  
She brings him spanish roses  
Cause she can still remember  
All of the spanish roses  
Her lover gave to her.  
Torero te quiero.  
Torero te quiero.  
  
And now he's just a dream  
That she used to love  
Cause deep inside her heart  
She's hold the memory of  
The days she used to watch him  
As the crowd sheered his name  
To the day he lost the battle  
And they carried him away.  
She brings...  
Torero...  
She brings...  
Solo  
Torero...  
She brings...  
She brings...

",Nature
Emmylou Harris,For No One,/e/emmylou+harris/for+no+one_20050152.html,"The day breaks your mind aches  
You find that all her words of kindness linger on  
She no longer needs you  
She wakes up she makes up  
She takes her time and doesn't feel she has to hurry  
She no longer needs you  
  
And in her eyes you see nothing  
No sign of love behind the tears  
Cried for no one  
  
A love that should have lasted years  
You want her you need her  
And yet you don't believe her when she said her love is dead  
You think she needs you  
She goes out you stay home  
She says that long ago she knew someone but now he's gone  
She doesn't need him  
  
And in her eyes you see nothing  
No sign of love behind the tears  
Cried for no one  
  
A love that should have lasted years  
Your day breaks your mind aches  
There will be time when all the things she said  
Will fill your head  
You won't forget her

",New Age
Hank Williams Jr.,Last Pork Chop,/h/hank+williams+jr/last+pork+chop_21033469.html,"Well you know you get the hots for some gal, you just can't stop  
Makin' love six times a day better than pork chop  
'Cause ones' good as the other and you know what I mean  
Some of them like a little bit of fat  
Some of them like that meat just a little bit lean  
  
I like gravy on the side with hot and juicy lovin'  
Brown sugar on top, sausage warm out of the oven  
Sometimes you get to eatin' Lord and you just can't stop  
Make me wonder to myself  
Why oh why, why did I leave that last pork chop  
  
Well met this fine gal in the choir, she sure could sing  
She said come down to my house  
I'm gonna give you ham hocks and beans  
We devoured each other Lord, her kitchen was smokin' hot  
I had to jump up and open a window and I thought to myself  
Why did I leave that last pork chop  
  
I have been on a very strict diet of beer and scotch and love  
I was offered lunch break specials, but now I'm a fool for her  
She'd been serving that pie while I was gone punchin' the clock  
I thought about that waitress down at Maxine's and I said to myself  
Why did I leave that last pork chop

",Noise
Virgin Steele,Rain Of Fire,/v/virgin+steele/rain+of+fire_20308009.html,"WE SUMMON THE SONS OF ANU,  
SPIRITS OF LIVING FIRE!!!  
  
In the night we gather for the slaying of the beast  
The chosen kings of fire summoned by the priests  
Lord give me strength to crush my enemies  
Their pain and their suffering will be music to my ears  
  
BURNING RAIN OF FIRE - wash away my pain, wash away my fate  
Let me rise up born again  
BURNING RAIN OF FIRE - blood runs from the sky, I'm the Lord of flies  
On the wings of hate I rise  
  
Soon it will be over abd we'll gather for the feast  
Hear the weeping of their woman as they grovel at our feet  
The gods have shown their favor, my victory is known  
Your gods have proven false, your death is mine to own  
  
BURNING RAIN OF FIRE - wash away my pain, wash away my tears  
Let me rise up born again  
BURNING RAIN OF FIRE - give power to my call, devouring their flesh  
Purify as all - RAIN OF FIRE  
  
Like a comet from hell  
devouring their flesh  
  
Trample to dust in the fire of lust  
With fire we slay all who stand in our way  
A covenant bound in the world underground  
We slash and we strike see your head on a spike  
  
Once free and so brave, now your people are slaves, oh...  
BURNING RAIN OF FIRE - the sons of Anu rise, the fields of blood are mine  
On a burning horse I ride  
BURNING RAIN OF FIRE - ravager of towns our covenant is bound  
In your kingdom underground  
BURNING RAIN OF FIRE - rape our enemies, burn their village bright  
In a golden wall of light  
BURNING RAIN OF FIRE - blood runs from the sky, the veils of death divide  
And the crucified arise - RAIN OF FIRE!!!  
  
Lyrics submitted by Karunga

",Norwegian
Diana Ross,Floy Joy,/d/diana+ross/floy+joy_20819634.html,"Floy, floy, floy  
Floy joy  
Floy, floy, floy  
Floy joy  
  
Floy, floy, floy  
Floy joy  
  
You're the man  
I know, I'll never own you, floy  
But see me when you can  
  
Ooh, ooh, I know  
I'm only one of a million girls  
Who would give their world to you floy joy  
  
Floy, floy, floy  
Floy joy  
  
That's your name  
Your real name may be Smith or Jones  
But not your claim to fame  
  
Oh, it's a joy, boy  
Any girl, who knew you at all  
Would have to call you floy joy  
  
Floy, floy, floy  
Floy joy  
  
I get a thrill when I hear your voice now, floy  
  
Floy, floy, floy  
Floy joy, you're the man  
  
How much joy do I get from you?  
You give me so much pleasure  
It's impossible to measure  
  
Floy, floy, floy  
Floy joy  
  
You're the man  
I hope in someway form or fashion  
I fit in your plan  
  
Ooh, take me  
I wanna give myself to you  
And live my whole life through with you  
  
Floy joy  
Floy, floy, floy  
Floy joy  
  
Floy, floy, floy  
Floy joy  
  
A-let me hear you say it one more time  
Say it again  
  
Floy, floy, floy  
Floy joy  
  
A-let me hear you say it one more time  
Say it again  
  
Floy, floy, floy  
Floy joy

",Opera
Mariah Carey,Lullaby Of Birdland,/m/mariah+carey/lullaby+of+birdland_21066603.html,"Oh, lullaby of birdland  
That's what I always hear,  
When you sigh,  
Never in my wordland could there be ways to reveal  
in a phrase how I feel  
  
Have you ever heard two turtle doves  
Bill and coo, when they love?  
That's the kind of magic music we make with our lips  
When we kiss  
  
And there's a weepy old willow  
He really knows how to cry,  
That's how I'd cry in my pillow  
If you should tell me farewell and goodbye  
  
Lullaby of birdland whisper low  
Kiss me sweet, and we'll go  
Flying high in birdland, high in the sky up above  
All because were in love  
  
Lullaby Lullaby  
  
Have you ever heard two turtle doves  
Bill and coo, when they love?  
That's the kind of magic music we make with our lips  
When we kiss  
  
And there's a weepy old willow  
He really knows how to cry  
That's how I'd cry in my pillow  
If you should tell me farewell and goodbye  
  
Lullaby of birdland whisper low  
Kiss me sweet, and we'll go  
Flying high in birdland, high in the sky up above  
All because we're in love

",Orchestral
Louis Armstrong,BE My Lifes Companion,/l/louis+armstrong/be+my+lifes+companion_20157894.html,"Be my life's companion, and you'll never grow old  
I'll love you so much that you'll never grow old  
When there's joy in livin' you just never grow old  
You've got to stay young 'cause you'll never grow old  
People who are lonely can be old at thirty-three  
Don't let it happen to you, it didn't happen to me  
Be my life's companion and you'll never grow old  
You'll never grow old, no, you'll never grow old  
Love and youth and happiness are yours to have and hold  
Be my life's companion, and you'll never grow old  
I know a man who's lonely, and he's old at thirty-three  
No one wants to be - old at thirty-three  
Your disposition sours like a lemon on a tree  
Don't let it happen to you, and I won't let it happen to me  
Be my life's companion and you'll never grow old  
I'll love you so much that you'll never grow old  
Love and youth and happiness are yours to have and hold  
Be my life's companion and you'll never grow old  
Be my life's companion and you'll never grow old  
Lucille, I'll love you so much that you'll never grow old  
Love and youth and happiness are yours to have and hold  
Be my life's companion and you'll never grow old

",Oriental
Perry Como,Hot Diggety,/p/perry+como/hot+diggety_20220312.html,"Chorus  
Oh, hot diggity, dog ziggity, boom what you do to me  
It's so new to me, what you do to me  
Hot diggity, dog ziggity, boom what you do to me  
When you're holding me tight  
  
Never dreamed anybody could kiss thattaway  
Bring me bliss thattaway, what a kiss thattaway  
What a wonderful feelin' to feel thattaway  
Tell me where have you been all my life  
  
Chorus  
  
Never knew that my heart could go ""zing"" thattaway  
Ting-a-ling thattaway, make me sing thattaway  
Said ""goodbye"" to my troubles, they went thattaway  
Ever since you came into my life  
  
Chorus  
  
There's a cute little cottage for two thattaway  
Skies are blue thattaway, dreams come true thattaway  
If you say I can share it with you thattaway  
I'll be happy the rest of my life  
  
Chorus  
  
Oh, hot diggity, dog ziggity, boom what you do to me  
How my future will shine  
Hot diggity, dog ziggity, boom what you do to me  
From the moment you're mine  
  
Hot dog!!

",Party
Misfits,Mars Attacks,/m/misfits/mars+attacks_20094051.html,"Their eyes for many centuries  
Peered in from space  
Sincere the hope, their wise believed  
They could teach our race  
  
But yet on Mars, a darker side  
Like all things that God made  
Their tribe of war, would heed them not  
""Earth they must invade""  
  
The fire in the skies  
Them devastate the land  
The warlord chief commands  
  
The humans fight and die  
Our planet laid to waste  
Monsters invade the earth from space  
  
It was then, in our darkest hour  
When everything seemed lost  
The hearts of men would not concede  
No matter what the cost  
  
They forged a sword of sound and steel  
Upon the Martian doors  
The voice of war would thunder there  
And ""Mars would be no more""  
  
The Martian cities fall  
The death of the warrior tribe  
Mars attacks, now their planet won't survive  
  
Their world turn into ash  
The terror on their face  
Mars explodes, cast out as rubble into space  
  
Whoa-oh, oh, oh  
Whoa-oh, oh, oh  
Mars Attacks: monsters invade the earth from space  
  
Whoa-oh, oh, oh  
Whoa-oh, oh, oh  
Whoa-oh, oh, oh

",Patriotic
